{
    "projectName": "sample",
    "timestamp": "Mar 5, 2019 at 6:27pm",
    "successRate": 100,
    "environment": "default",
    "tags": "",
    "executionTime": 381,
    "executionStatus": "pass",
    "specResults": [
        {
            "specHeading": "Specification Heading",
            "fileName": "/Users/apoorva/Projects/gopath/src/github.com/apoorvam/sample/specs/example.spec",
            "tags": [],
            "executionTime": 59,
            "executionStatus": "pass",
            "scenarios": [
                {
                    "scenarioHeading": "Vowel counts in single word",
                    "tags": [
                        "single word"
                    ],
                    "executionTime": 58,
                    "executionStatus": "pass",
                    "contexts": [
                        {
                            "itemType": "step",
                            "stepText": "Vowels in English language are \"aeiou\".",
                            "parameters": [
                                {
                                    "parameterType": "static",
                                    "name": "",
                                    "value": "aeiou",
                                    "table": null
                                }
                            ],
                            "table": null,
                            "beforeStepHookFailure": null,
                            "beforeStepHookMessages": [],
                            "afterStepHookFailure": null,
                            "afterStepHookMessages": [],
                            "result": {
                                "status": "pass",
                                "stackTrace": "",
                                "screenshot": "",
                                "errorMessage": "",
                                "executionTime": 0,
                                "skippedReason": "",
                                "messages": [],
                                "errorType": "assertion"
                            }
                        }
                    ],
                    "teardowns": [],
                    "items": [
                        {
                            "itemType": "step",
                            "stepText": "The word \"gauge\" has \"3\" vowels.",
                            "parameters": [
                                {
                                    "parameterType": "static",
                                    "name": "",
                                    "value": "gauge",
                                    "table": null
                                },
                                {
                                    "parameterType": "static",
                                    "name": "",
                                    "value": "3",
                                    "table": null
                                }
                            ],
                            "table": null,
                            "beforeStepHookFailure": null,
                            "beforeStepHookMessages": [],
                            "afterStepHookFailure": null,
                            "afterStepHookMessages": [],
                            "result": {
                                "status": "pass",
                                "stackTrace": "",
                                "screenshot": "",
                                "errorMessage": "",
                                "executionTime": 58,
                                "skippedReason": "",
                                "messages": [],
                                "errorType": "assertion"
                            }
                        }
                    ],
                    "beforeScenarioHookFailure": null,
                    "beforeScenarioHookMessages": [],
                    "afterScenarioHookFailure": null,
                    "afterScenarioHookMessages": [],
                    "skipErrors": [],
                    "tableRowIndex": -1,
                    "scenarioTableRowIndex": -1,
                    "retriesCount": 0
                },
                {
                    "scenarioHeading": "Vowel counts in multiple word",
                    "tags": [],
                    "executionTime": 1,
                    "executionStatus": "pass",
                    "contexts": [
                        {
                            "itemType": "step",
                            "stepText": "Vowels in English language are \"aeiou\".",
                            "parameters": [
                                {
                                    "parameterType": "static",
                                    "name": "",
                                    "value": "aeiou",
                                    "table": null
                                }
                            ],
                            "table": null,
                            "beforeStepHookFailure": null,
                            "beforeStepHookMessages": [],
                            "afterStepHookFailure": null,
                            "afterStepHookMessages": [],
                            "result": {
                                "status": "pass",
                                "stackTrace": "",
                                "screenshot": "",
                                "errorMessage": "",
                                "executionTime": 1,
                                "skippedReason": "",
                                "messages": [],
                                "errorType": "assertion"
                            }
                        }
                    ],
                    "teardowns": [],
                    "items": [
                        {
                            "itemType": "step",
                            "stepText": "Almost all words have vowels",
                            "parameters": [
                                {
                                    "parameterType": "table",
                                    "name": "",
                                    "value": "",
                                    "table": {
                                        "headers": [
                                            "Word",
                                            "Vowel Count"
                                        ],
                                        "rows": [
                                            {
                                                "cells": [
                                                    "Gauge",
                                                    "3"
                                                ]
                                            },
                                            {
                                                "cells": [
                                                    "Mingle",
                                                    "2"
                                                ]
                                            },
                                            {
                                                "cells": [
                                                    "Snap",
                                                    "1"
                                                ]
                                            },
                                            {
                                                "cells": [
                                                    "GoCD",
                                                    "1"
                                                ]
                                            },
                                            {
                                                "cells": [
                                                    "Rhythm",
                                                    "0"
                                                ]
                                            }
                                        ]
                                    }
                                }
                            ],
                            "table": {
                                "headers": [
                                    "Word",
                                    "Vowel Count"
                                ],
                                "rows": [
                                    {
                                        "cells": [
                                            "Gauge",
                                            "3"
                                        ]
                                    },
                                    {
                                        "cells": [
                                            "Mingle",
                                            "2"
                                        ]
                                    },
                                    {
                                        "cells": [
                                            "Snap",
                                            "1"
                                        ]
                                    },
                                    {
                                        "cells": [
                                            "GoCD",
                                            "1"
                                        ]
                                    },
                                    {
                                        "cells": [
                                            "Rhythm",
                                            "0"
                                        ]
                                    }
                                ]
                            },
                            "beforeStepHookFailure": null,